username,rating,time,votes,comment
GIVIND,5,2020-12-09 18:53:21,7,调查兵团一度快死绝了——什么是大无畏的人类英雄主义精神啊（战术后仰）；卫城之战热血冲出屏幕，兵长螺旋肢解猩猩巨人帅爆苍穹！高ping卡顿尖叫！！！献出心脏！
windy,5,2019-11-18 21:25:11,4,看完这一季终于把巨人的世界观搞清楚了，闹了半天说的是民族主义问题，两个民族互相争夺资源罢了，谁也没有所谓的正义，“真相”就像历史一样是由胜利者书写，可以随意篡改。墙里尤弥尔的传人能变成巨人，马莱人则不行。莱纳、阿妮他们似乎是被洗脑或是有什么把柄人质在马莱政府手上，所以来墙里抢夺始祖巨人的坐标。初代王是个和平主义者，将这种力量封锁在三层墙里，把人民的记忆抹去了。作者的历史观、价值观都融入到了作品之中，艾伦VS铠之巨人、阿尔敏智取超大巨人、埃尔文团长的“特攻”、利威尔兵长单杀兽之巨人，这些战斗场景很燃很给力！后期则主要在揭露这个世界的真相。虽说好看，但我总感觉作者在给二战中的日本洗白，小岛不就是日本吗？就像艾尔迪亚人一样，日本人在二战中是加害者，被美国干服后又被“欺压”成了被害者，政治意味很浓啊
小阿,5,2021-04-25 20:33:03,1,看爆就完事儿了。
口苗君🌊,5,2020-12-16 20:51:57,4,兵长砍猴十星！
特拉法爾諾,5,2019-11-09 01:33:05,5,S3下半玛利亚之墙夺还。这个Part就确实相当厉害了……无论是对方还是己方的各个角色都很出彩，几场战斗也是让人鸟肌的那种棒。话说没想到都9102年了团长和兵长还在杀我【。】他俩的故事前后呼应也太完美了让人落泪。OnoD和Kamiya的演出也是赛高≧﹏≦！但……就还是……心疼兵长……
山风,5,2019-06-04 13:56:01,16,原本以为上集的勇者是满分，这集里埃尔文和阿尔敏的选择真的是棒到炸！！！！为什么只有五分，我要十分！！！！！
灵能路人,5,2019-06-10 09:51:07,30,艾尔文死了，小天使活活被烧干了！！！心疼的我哭出声来！！！虽然明知小天使不会死。看完part1的时候，有人说巨人越来越垃圾，武斗改文斗了。这回part2让你们集体闭嘴！巨人这一部要封神了，我见证了一部神作诞生，成长，最后登上神坛。太幸运了！！！
Oblivión,5,2021-01-26 07:54:46,5,！！！献出心脏了！！！
Aki.,5,2021-07-05 16:50:51,3,这一季巨人在我心里彻底封神。史诗般的故事，哲学色彩的两难抉择，荒谬的真相和宿命，重重叠叠的隐喻和伏笔，共同造就了充满古典戏剧气息的张力与美感，在白夜一集中达到顶峰。那个地下室宛如柏拉图所说的洞穴，意味着启蒙。然而，当长途跋涉走出洞穴找到的真相，不再指向光明和胜利，而是残酷与讽刺，一切坚固的东西烟消云散了。自此成为分水岭，人类的高歌由盛转衰，从启蒙时代进入至暗时刻。即便如此，痛苦的苏格拉底和快乐的猪之间，我仍选择前者，那是埃尔文留下的遗产。在这个残酷的世界，唯有清醒独立地思考，而后坚定选择，方能在虚无人生中获得意义和自由。
李大可,5,2019-07-02 22:08:39,22,part2结束留念。室友被我拉入坑，天天问我各种关于巨人的问题，实在是想跟他解释，跟他讲后面有多么的卧槽，但是又不忍心告诉他，我觉得应该让他之后自己去卧槽🤔
清漪🍀💫✨,5,2020-06-30 13:22:30,13,剧情满分，配音满分，画面满分，人物满分，声优满分，所以这剧评分为啥才9.8分？
亲爱的猥琐猪,5,2019-10-01 21:10:24,10,看到这里才终于知道“进击的巨人”这漫画名的含义。玛利亚墙夺还战，在故乡腹背受敌的惨烈战况被荒木哲郎百分百体现出来，太震撼了！背水一战冲向兽之巨人的团长与调查兵团新兵让人想到米那斯提力斯保卫战，而兵长在黄昏中面对两难抉择向团长说出的话又有黑暗骑士的感觉，最后看海的一段算神来之笔了。谏山创也是真喜欢拆CP，或者说把造化弄人发挥到极致吧，新入调查兵团的宪兵团小哥啊，可惜了。最后四集终于揭开故乡地下室秘密，全貌终于得见一角，原来这是个融合了北欧神话和圣经的故事，或者说，把许多神话与历史的“设定”融合在同一个故事里。第三季大概到漫画90话，很期待传言中一年后的最终动画了。
失控的杏鲍菇,5,2019-06-07 20:31:01,16,存在主义大作进击的狗金，巨人从第三季开始终于真正可谓牛逼。
鳴海,5,2019-04-29 02:14:03,11,哇塞 滿屏的巨人就問你怕不怕？
纠结咪,5,2021-01-13 00:56:29,5,大意了。第三季分两个条目，不仅错过了标记，也与团长永别了，标记可以补，艾尔文却只能在看海的时候分外怀念了。
五月,5,2019-06-10 19:47:29,25,最近的几集剧组和疯了一样，文戏细腻感人，武戏帅裂苍穹，感染力极强的演出和作画，偏偏还有着深刻古雅的内核，吹得我都不知道该怎么吹
疯猫,2,2019-05-28 18:24:32,6,不管漫画多好看，动画这个拖拖拉拉啊，磨叽到炸毛~
迷失东京,5,2022-11-07 14:51:43,5,在这炼狱般的人生中，把他救回来并不是真的爱，让他卸下重担，就此死去，才是对这个人物保有的最大的温柔，兵长我真的爱。
若初,5,2019-06-11 23:45:34,7,业界希望
龙少,5,2019-05-26 20:20:13,22,"重温了一遍巨人，我可以确信，在我目前为止看到过的所有的动漫作品中，它可以排在......第一位！

巨人的价值观里带来对自由的诠释，对死亡的诠释，对国家政治的诠释，对个人意义的诠释，对阶级斗争的诠释，对真理的诠释，对恩怨轮回的诠释......我只有在严肃的文学作品里得到过同样的感受。"
看人生,5,2020-07-07 18:25:48,4,这一季一战成神作，太爽了，未来的展开也很期待
有心打扰,5,2020-08-27 00:37:50,1,全篇高能；夺回玛利亚之墙-与兽之巨人、铠甲巨人和超巨型巨人的攻防战、埃尔文团长之死、地下室之谜、一切的起源、海的对面。
棉线太阳,5,2019-06-08 11:33:32,17,对兵团两人刻画得太好了吧！利威尔会说“放弃你的理想为了人类去死吧，我会解决野兽巨人”，艾尔文也懂得利威尔懂他。这季是“去看大海”的理想还存在的最后一季了，单纯与巨人战斗的岁月已经过去，哎。
NamesPitt,5,2020-02-29 19:13:28,7,53-55共三话围绕玛利亚之墙夺还战展开的故事完全是历史最佳的动画水平，除了震撼还是震撼，除了悲壮还是悲壮。比起永远在的白夜中负重前行，就此眠去也许未尝不是一种解脱，我永远喜欢埃尔文·史密斯。
叛道者须同,5,2019-05-07 21:37:22,14,怎么回事，只有4200人看过？难道大家都不爱巨人了吗
脫繮的蛇肉堡,5,2019-10-19 05:41:58,1,趁没人发现赶紧改6星//當之無愧巨人拍到現在最好的一季，wall maria奪回戰的節奏很不錯啊（團長啊啊！！【すすめ！！】），其實整季節奏都比較快，除了basement那一集，我的媽唷走到地下室走了一整年的趕腳。以及zeke你要臉嘛，被levi當黃瓜砍最後來一句「lets call it a draw」？不喜歡打針那裡，levi不給團長的理由（？）沒什麼說服力⋯⋯以及eren真的好迷好迷好迷⋯⋯
梧桐树下你和我,5,2019-12-30 12:54:06,8,我想问 豆瓣有 6星或者10星吗？！5星根本不够评！
Aletheia,5,2021-02-24 11:27:04,5,"「放弃你的梦想，迎接死亡吧。」
《完美比赛》《勇者》《白夜》，永远的神。永远的神！！！！！！"
疼酱,5,2021-06-08 03:00:43,2,第三季part2真的太燃了，兵长砍猴那段，一句“我发过誓”的，听得我泪流满面～和Aki一起看完了，真的超级开心～
岁月何须溪上记,5,2019-07-03 10:14:09,12,六年前刚开始追《进击的巨人》动画的时候，只觉得它是佳作，当年的大热门而已，跟封神还有段距离。结果漫画追下去，大呼牛逼，已经封神。后来追完动画的第二季第三季，虽然看过漫画知道剧情，但感觉动画表现力比漫画还是要强一些，画面处理更细腻，配乐也相得益彰，结论是动画还是值得看的。本以为动画第三季 part 2 会这么四平八稳地播，没想到又给我带来惊喜。总第55集，真是将原著已有的封神水准持续推高。不怕打脸，《进击的巨人》很大可能是我们有生之年最强番。六年前刚开始追的时候我没有意识到这一点，直到前年才有所察觉。漫画已近尾声，作品本身和作者谏山创都必将载入史册。
Aaron,5,2021-02-26 01:21:27,5,"浪漫与求真的碰撞，功利与存在的较量。
无愧一季封神！！！"
火娃,4,2023-03-13 12:19:12,5,8/10。[巨人]的生存哲学建立在狰狞的死亡上，即使是带领调查兵团的英雄团长埃尔文，在主动迎向猿巨人赴死的时刻，脸上依然直接流露出死亡的恐惧。动画用很多鸟瞰视角去补充士兵的虫瞻视角，落石如迫击炮般在废墟内轰然炸开，尘土、人和马匹的尸块在幸存者身旁飞快的闪过，猿巨人俯瞰着他完美落下的碎石轨迹，在建筑群落上划出一大片血雾，士兵则带着马躲在高墙一侧、暂且偷安，作为退离这个大逃杀状态的是墙外的世界：许诺自由，不必经历生存之恐怖也能堂堂正正活下去的世界。但阿伦指向海那边的一幕，瓦解了向死而生带来的自由与崇高，统治大陆的马莱人畏惧尤弥尔子民的巨人之力，使滞留的尤弥尔子民沦为禁居的劣等民族，要么努力获得荣誉马来人的战士身份，要么被流放到岛上变成只会噬人的无脑巨人，于是解放同族，意味着两种民族作炮灰继续相互屠戮。
电焯人,5,2023-06-13 14:58:21,9,如果我把那边的敌人全部杀光，。
风雨如磐,5,2022-04-19 13:51:53,6,震撼的哑口无言，无论是旁观者无言的心酸与存在的价值，还是白夜将至燃尽最后一点执念的落幕。我凯他超、自我开启，伏线千里的设计让人拜服，谁能想到这出自一位普通漫画家的首部作品
蓝毛水怪,5,2019-07-10 08:08:04,4,deadline使人追剧。
hellstay,5,2019-06-19 16:49:17,27,当世代下，人类最佳商业艺术作品之一。
沙力兔,4,2019-07-18 00:42:42,3,"啊啊啊啊在anbl家发现更新了 看到他们用雷枪那集了！好急！阿尔敏脑子太厉害了 全村没有他真的不行 列维毫不犹豫地从城墙上往下刺杀莱纳那段啊啊啊啊 其他人都没这个决断力 还犹豫要不要动手呢 啊啊啊这就结束了本季！原来是真.山外有山 人外有人啊！决定留下阿尔敏 因为他有对海的梦想 莫名戳了（2020 6月二刷第二第三季！莱纳决定带所有新兵送命那段 阿尔敏扛着火焰直到失去知觉 都是泪点TAT 兽毛巨人”说是要我小心一个士兵"" 还没回忆起来就被剐去了眼睛 兵长太强了TAT mikasa怎么看都是最靠谱的 失去一只眼的韩吉忽然出现 ”做得很好“ 然后继续一个雷枪击中莱纳的下巴 帅气 本以为她光荣了…… 原来进击的巨人 是九大巨人之一的名字 也就是艾伦的名字 (真心不知道去年一点点追是怎么熬过去的！"
默城君,5,2019-05-31 14:33:51,12,觉得燃是因为感觉没开挂，但是打赢了。这场面足够足够震撼了。
老罗Lazzaro,5,2020-12-30 01:09:20,0,双面夹击，敢死勇者。E6利维的抉择，太好哭。E8地下室与信息量巨大的真相。始祖巨人。记忆交错。未来的意志，未解的敌人。
普通人,5,2019-06-17 11:39:46,21,每集都是惊喜啊啊啊，世界观又更新了，赞到爆炸。
生人回避,5,2021-05-22 20:01:57,3,真 结局
白玉京,5,2023-08-28 00:58:00,3,"知道了世界的真相之后呢？是无尽的痛苦。
我相信埃尔文肯定也会想到，所以他选择这样悲壮地死去。
埃尔文是无情的英雄，也是温柔的恶魔。"
arlmy,5,2019-07-20 23:26:22,7,7.7 又又又完结了。数这季最牛逼了。但看漫画觉得后面还能再爆炸。
天气那么好,5,2019-04-29 00:43:59,9,巨人是天
Miss Coconut,5,2019-11-07 12:51:49,4,虽然在看之前就基本上被剧透完了，但是带给我的震撼一点都没变，故事太有深度了，人物太丰满了，动画太精致了！！五星吹爆都不够啊！无比期待下一季！不知道最终会怎么结束，这季把大背景大悲剧基本讲了，剩下的就是个无解的世界。在Ricky的要求下看的英文版，Eren终于不再每讲一句话都是喊叫了哈哈~
我是小狗,5,2022-03-18 16:10:03,4,"不论是谁都不可能永远在一起。
想到了第一次看巨人的场景。"
麻麻林,5,2020-06-17 17:54:30,8,进击的巨人到S03 part 2真正升华到了神作的地位，打五星都不足以表达我的敬意，也应了一个普遍的准则：流传后世的伟大作品都以悲剧为内核。团长的死可以把人虐哭，残酷的两难抉择才体现世界的真实。皮克西斯司令说：如果我们不把真相还给人民，夺取了雷斯政权的我们又正义何在呢？如此左的作品，竟然在某国被打赏右翼标签而禁播，怕不是刺痛了某些人软弱的神经。而更为震撼的是接Alan和Alvin的嘴阐述的“人间即地狱”的观点，和三体的高度有的一拼，在此再次向团长纯粹的求真致以最高的敬意。
T.V.Zoe ி,4,2025-10-09 14:40:28,0,兵长的打戏太精彩了拍手叫绝，人类太坏了还是灭绝了好，海的对面不是自由，如鲠在喉。
Darkness,5,2019-04-29 13:37:14,10,我日，虽然已经看过一遍漫画了，但是看完第一集的时候仍然热血沸腾。新OPED都好听。巨人系列算日本TV动画顶尖之一了。54阿尔敏献身，泪，流出来了。
复制人罗伊,4,2019-07-01 04:03:48,7,漫画第88话点题超神之笔的疲软潦草真的是狂怒，几乎败掉了《完全比赛》、《勇者》、《白夜》的风评狂飙三连击，这一次真的不能五颗星，拿着惊天地泣鬼神的玛利亚墙夺还战篇，以及开始散发文学气质的地下室揭秘墙外篇，这样漫画史上屈指可数的原作本子，做得跌跌撞撞，当代日本动画的扛把子失去了冲击历史级TOP地位的格调，魔改台词甚至把唯物主义辨证弄成历史虚无主义，漫画党再怎么解释，连动画党自己都懒得去看原作，中国的黑子这下抓到了辫子又怎么会去愿意查清事实……
薄暮秋风起,5,2023-03-16 17:59:27,5,从走向地下室的那一刻开始，巨人不再是一个模式化的热血动画，而是走进了深刻反思人类战争命运的经典行列
魚䲆鱻䲜,5,2019-10-15 16:11:09,18,没想到第二季和第三季前篇连豆瓣条目都没有，封得这么彻底。三天之内看完的第二季，第三季，第三季Part.2，十分连贯精彩。剧情由第一季单纯对巨人的恐惧，到第二季知道更多人类可以变成巨人的转折，到王政篇人类内部之间的勾心斗角，又到后篇里为真相而做的惨烈牺牲，一步步有节奏的推进再加上激烈的战斗和赤裸裸的残忍，堪称酣畅淋漓的封神之作。艾尔文被吃掉一个胳膊时高呼的前进，兵长刺杀莱纳和猿猴的炫酷，艾尔文带领新兵赴死演说的慷慨激昂，被迫在团长和阿明之间必须做出选择时摆在面前的赤裸裸残酷。画风细腻，制作精良，近年来最好动画，没有之一。
lucifer,4,2019-12-08 17:49:26,2,万万没想到这一步的动漫评价竟然这么高，不可以接受啊。这一步主要有两部分，前一部分是玛丽亚争夺战，主要是攻打铠甲巨人和超大巨人，超大巨人被打死了。阿尔敏因为主角光环继承了超大巨人。整个调查兵团几乎全军覆没，只剩下了那么十几个，因为主角光环太强大，而活下来的人玛利亚之墙被夺回。后半部分就是讲他们在地下室没发现这个世界的真相。世界有两个种群构成巨人，是马来人为了清理他们这个种族饿做的，一共有9个有智商的巨人。在最后的结局，他们到达了马来人的城墙下，看到大海，但是艾伦觉得这一幕相识。看到这一步的感觉就是我都已经看了这么久了，马上都要准备看大结局的时候，没想到这个故事刚刚开始序幕，世界观刚刚形成，不知道要填坑填到那点才能看完。
萤木C,5,2019-07-03 23:40:29,13,这季确实好看，即使之前看过剧透也不影响观感，层层剥开背后的秘密真是震撼，作者早已把境界从正义与邪恶间的庸俗对抗中拉高了几个层次，世界并不是非黑即白，历史也是任由美化篡改，各执一词，巨人之力可以是罪恶也可以是赏赐，能构思出整个大设定就已经很厉害了，人物还都塑造得很好，大战也令人紧张和亢奋，比起爆米花大片真得好看多了
JOAJIA,5,2019-06-06 10:31:54,11,没打五星的我单方面宣布可以瞎了
利器prost,5,2019-07-05 23:53:13,5,时间太长作者忘记设定，坑挖太多填起来费劲——这季填了几个大坑又挖了几个小坑，鉴于断断续续看漫画在前追番在后导致细节连贯不起来也不知道到底算谁的锅的了。披着巨人皮的战斗番跟初号机没什么两样，兵长始终是兵长，Ellen•Jäger赶紧挂了才是真神作 ╮(╯__╰)╭  第四季的发展就当成是八木教广未完成的远征大陆部分来看好了
银色7.62,5,2019-06-14 13:38:49,8,太精彩了……
天林野草,5,2019-05-13 18:11:29,17,"大爷永远是大爷，这个4月，权游，复联，巨人都迎来最高潮，只有巨人没让我失望。

看完第三季，真的非常幸运见证一部超神剧的诞生，无论文戏武戏都精彩绝伦，无比期待明年的10月。"
夜巡者蝎蝎fih,5,2019-05-27 06:10:48,28,被第54话看懵了。真的除了卧槽啥也说不出来。心里又一部六星。二十几分钟内讲述了三个小战场即将走向胜利的结局，残酷的代价，外加一如既往优秀的制作，使这部作品远远优于其他作品。ps：谏山创跟老虚真的不是兄弟吗(#‵′) 看完55话再来吹一波…干部组怎么一个比一个有人格魅力啊，这一季刚爱上团长就(;´༎ຶД༎ຶ`)从此成巨人厨
空山,4,2021-01-10 12:15:06,1,大战真精彩！终于到达地下室了！
本因坊秀智,5,2024-01-30 21:57:21,2,玛丽亚城墙大战真是前三季的高潮，救团长还是救阿尔敏那一段的抉择太虐了。不过随着艾伦父亲的回忆被揭开，基调要整个被颠覆了。如果能停在大海就好了，但是不行啊，一切的悲剧结局已经都写定了。
罐头鱼,5,2020-04-08 22:39:25,9,"我已经做出选择了，放弃你的梦想去死吧，带领新兵冲向地狱，兽之巨人由我解决。
兵长让团长放弃梦想去死的时候，他帮团长从执念里解脱了，兵长选择不把针剂给团长的时候，他帮团长从道德感的自责里解脱了。兵长说我出于私心不救埃尔文，但他自己带着一个誓言留在这残酷的世界上。
我爆哭，谏山创是什么魔鬼人物塑造。白夜这话，每个角色的行为理由都充分正当，这样给观众的刀才扎得更深。阿尔敏确实是那个应当被留下的人，他对未来还有希望，而团长的未来只有责任和痛苦。团长的道德感太强了，他责怪自己用为人类献出心脏的凛然大义包装私心，但他所做的每一件事都对人类有贡献。"
evening77,5,2019-11-17 14:10:29,6,海的对面不是自由，是敌人~我看个番居然给我出电车难题我真是很服气的啊，阿明和团长究竟选谁的问题，最后团长那一甩手我明白了，做出决定的不是兵长还是他啊~隐隐觉得是场惨烈大战怎么也没想到便当是批量生产的，兵长砍猴那里爽了就完事了，莱纳这血是真厚啊，看到尤弥尔给希斯特莉亚写的情书瞬间就崩了，让她们见一面啊混蛋！贝特霍尔德被巨人化的阿明吞食的时刻我的心情也是复杂的，这家伙喜欢着阿尼啊，临死也没能再见上一面啊，阿尼你在哪里啊？终于打开地下室的门，看到的却是各种颠覆常规的信息，吃妈巨居然是戴娜这太恶趣味了吧~子安又配了个变态~明年10月最终季了，为团长献出心脏！
hunterst,5,2019-06-13 21:39:42,32,之前以为有军国主义思想很鄙视，看了之后发现很惭愧
乔乔福音,5,2019-12-11 11:20:13,21,满分神作，我为我之前的轻蔑而深深忏悔
中二病，大好き,5,2019-07-04 11:05:05,6,看到古利夏回忆录那两集时，我一度以为作品含有作者不愿意承认历史的倾向，并且还代表着一部分本国的人。但到最后我明白了，他想传达的是他的一种思考：没有谁对谁错，只是立场不同。毋庸置疑这种思考也是错的，但通过此而创作出的作品无疑是伟大的，是21世纪第二个十年的瑰宝。
1Z,5,2019-06-05 12:14:05,9,论如何在疯狂的世界里保持理智
才不穿袜子,5,2019-06-18 11:54:27,13,谏山不到二十岁的时候到底经历了什么？知识面又深又广且面面俱到，国际政治，社会心理学，存在主义哲学，叙事结构，推理线索设置，战术布置… 不是单有才华能做到的事了。‘严肃小说’作品里还有那部能全面追上巨人这种雪崩现象级的创作？人物塑造也成功，甚至还有弗洛克这样的功用主义者存在，日常说大实话。有如神创世。
骤雨至,5,2025-08-23 10:25:52,0,这季的确好。客观来说，谏山创对整个作品的构建和推翻也做得很厉害——通常而言，在中后期推翻前期做的所有铺垫，试图通过与前期呈现出来的主旨背离而达到震撼读者目的的作品，前期是做不到这么吸引人的，而巨人无论是前期热血上脑的英雄主义，还是这一部呈现出来的虚无和悲哀都做得很吸引人，文本功力了不起。
zzhong,5,2021-01-16 23:37:04,7,越来越接近真相 越来越承受不起
某J。624,5,2020-06-24 13:54:12,7,如果说前三季只是好看，那么这一季当可封神，尤其是ep54、55，从剧情到核心到制作，全程炸裂。一直觉得巨人很会发便当，团长之死的设计更是叹为观止。结尾落在初始就提及的「海那边的自由」，可答案却是更深的绝望。P.S.再次嚎叫兵长太特么帅了！！
清舞翩翩,5,2019-05-14 10:25:43,6,不自由毋宁死，兵长依旧开挂。男主依旧公主化，三笠依旧帅。阿尔敏小天使大脑担当，团长依旧是领导果决。献出心脏，为了自己！！死亡笔记导演+第二季开始的新导演肥塚正史产生化学作用，不要烂尾。越来越燃，终于等到你！！
今朝醉水,5,2019-07-26 06:43:13,11,真的勇士，未必心如磐石，冷若冰霜，而是在绝境中也可以让执念战胜情感，给众人带去希望。团长的冲锋，阿明的坚持，兵长的选择，都是可以记入动漫史册的片段。而真正的神来之笔：众人向往，为之战斗为之牺牲的墙外，并非自由的乐土，而是更为残酷的全世界。
荞麦安娜娜娜,5,2019-07-14 18:08:00,5,啊，哪里才有真正的自由…有人的地方就有江湖…艾伦要黑化了吗
Hola,5,2019-12-08 22:45:42,5,巨人完美诠释了，当你以为发现所谓的真相时，世界总会给你一个更加残酷和真实的答案
Guann,5,2019-05-20 19:23:33,40,团长带着新兵冲向地狱那一幕看得我脑袋发麻鼻子发酸。埃尔文用自己的生命践明了他说了三季的“为人类献出心脏”这句话。没有犹豫，没有胆怯，只为将意义托付给下一个生者。这种一往无前，向死而生的精神，已经足够把进巨推上神作的高度。
梳子等河山,5,2019-06-10 18:15:57,20,最新三集奠定了巨人神作的地位
织姬无意,5,2019-06-08 11:34:14,7,哭的稀里哗啦，做选择的痛苦，毅然奔赴死亡的悲壮，舍弃梦想，舍弃生命，舍弃一切！彻底的神作，值得满分！
Jeremiah,5,2020-06-14 17:55:07,6,【200614】9.7-最后5集全!程！高！能！如果让我评选巨人最牛逼的段落那《白夜》必定上榜！如果换一般的番，估计会安排团长回光返照，让他说一堆大义凛然的话，反正就是不要救我救团员。巨人的设计是什么？只让埃尔文做了一个无意识的动作，这便胜过千言万语。这一季开始越来越喜欢韩吉了。等不及第四季去把漫画补到6月刊了
Luf Lanfkaij,5,2019-06-25 14:18:01,12,神作！如果是普通番剧，最多就是墙内的人类打倒巨人夺回世界的故事。神剧就是打倒这些巨人了解真相只是开始。剧情在这一季完全铺开，终于不在郁闷这个墙到底是干嘛的了，豁然开朗的感觉。
momo,5,2020-05-17 21:44:08,0,换了歌手总算好些了。其实看了这么多，没有什么喜欢的人
飞跃疯人球,5,2019-06-06 19:38:41,7,9.8  神作
