username,rating,time,votes,comment
复读姬da🌟ze,5,2019-05-03 21:44:49,4998,我觉得五星太过有失偏颇了，就这种剧情作画以及分镜配乐……也就十星的水平
Zzzz,5,2019-05-15 16:31:55,3597,权游的编剧进来学学，看看人家是怎么杀角色的
Fridy777,5,2019-04-28 07:40:36,2247,我的青春不止火影复联，还有巨人
薛定谔的加菲猫,5,2019-04-29 08:27:46,2070,我有个愿望，巨人能像火影海贼一样成为长篇动漫，周更
soyo(已黑化),5,2019-04-28 09:36:20,2041,"到海边一般是是福利回，在这里我却看到了兵长:小心点韩吉，可能有毒！😂
看到第四集，心里很难受，调查兵团几乎全灭，团长一路走好
但是，你们的死亡绝不是毫无意义的！
正如团长所说，""为那些死去的士兵赋予生存意义的是我们，那些勇敢的死者，那些可怜的死者，能够悼念他们的，只有身为生者的我们，我们将会在这里死去，将这意义托付给下一个人，这正是唯一一个对抗这残酷世界的方法！
士兵们愤怒吧！
士兵们高呼吧！
士兵们战斗吧！""
献出心脏！
为人类的自由和未来献出心脏！！
调查兵团就是这样一群没有特殊能力、血肉之躯却甘愿用自己的牺牲来换取人类未来的普通人，正是因为如此才更加令人敬佩！
虚假的繁荣，家畜的安宁，百年笼中鸟，片刻自由人
""我们从出生开始就是特别自由自在、无拘无束的人啊！""
一起去看海吧，艾伦"
ridah,5,2019-06-04 00:36:44,1582,老师，墙外没有人类的结论，是怎么调查出来的？
Kannimeia,5,2019-05-15 11:54:46,1864,在冰与火第八季的衬托下，这部进击巨人的质量已经可以封神了。
琴酒,5,2019-09-24 10:22:17,1316,开始时讨厌这个片子的内核。它不断通过将宏大的历史叙事和人类的存亡相勾连，教诲人在某种危机时刻慷慨赴死的意义，为了通往未来某一刻、为全人类的生命与自由必须牺牲的现在，这种历史观没有任何动摇地展现出来，我实在太不喜欢。但当艾伦重回地下室，得知世界历史部分真相，那套追逐自由的人类历史叙述被完全摧毁，谁才是压迫者，谁才是反抗者，谁拥有正义的位置，所有惨烈的牺牲都无法再在历史中被锚定。谏山一举刺破了所有坚固的东西。他们最终来到那片象征着自由的大海，却是如此深刻的悲伤。
弱水轻寒,5,2019-05-01 11:43:38,1679,巨人的叙事结构有一种古典美，以及，确实是近期唯一带脑子打仗的了。 现在是2024年，不知道看了第几遍了，每次都还是哭得一塌糊涂啊…
momo,5,2019-04-29 20:34:20,1407,才第一集你们就截了两百多张图😂
哦，我的小美人,5,2019-04-28 09:28:00,1473,你大爷永远是你大爷
不务正业的Dr.J,5,2019-05-20 17:21:44,1020,"我们将会在这里死去，
将意义托付给下一个生存者，
这是唯一一个，
能够对抗这残酷世界的方法。"
非常好的油桃,5,2019-04-29 09:51:35,1157,想起那时从进巨入动漫坑的我 真是幸运得不像话
纯Jun,5,2019-04-29 07:56:39,1122,作为一个只看动画的人，对这个第一集的进展节奏感到叹服了。非常严密谨慎，又处处转折，最后还藏了个大招。
很困的阳仔,5,2019-04-28 17:46:06,940,艾伦和三笠啥时候能在一起啊……
慢慢常常,5,2019-06-03 10:46:57,725,“你们放过他吧。”----致敬最温柔的兵长
76,4,2019-05-07 23:59:39,117,巨人又开始斗殴啦
missmystery,5,2020-12-10 11:19:35,499,多年之后，面对行刑队，格里沙·耶格尔将会回想起，他带着妹妹去见识齐柏林飞艇的那个遥远的下午。
01-04,5,2019-04-29 09:59:29,829,用超级好看来形容都苍白无力！
嘉声,5,2020-07-11 23:08:39,439,埃尔文团长死在了真相黎明的前夜，现在回头看只感觉他无比幸运。死亡是无情战士永恒的休憩，而他至死都是个渴求理想的少年。
Smooth,5,2019-06-10 21:08:25,544,以前觉得被封是因为血腥，现在翻回来看看，是涉政了吧
Time,1,2019-09-28 01:36:35,115,"这作毫无疑问是篇历史影射。但最终走向情绪煽动还是反讽尚不可知，取决于作者之后能否对艾伦所谓的“自由”解构批判。
岛上人被陆地人厌恶，认为是犯罪者和怪物的设定不必说。掌控巨人的雷斯王族的不战契约直指战败后和平宪法主动放弃战争权，营造虚假的和平。艾国和马莱篡改历史的情节，指代“政府和国际社会把虚假的历史和罪恶感强塞给岛国人”的思潮。军队推翻软弱王政，主张对外扩张更是被作者赋予了代表人民利益的正当性。格里沙回忆父母说自己的祖先是犯罪者时说:“(父亲)像狗一样，一个劲贬低自己的祖先”，“祖先的错和我们有什么关系”。后来发现古籍里祖先才是发展建设大陆的人，认为“加害者”的历史是被陆地人杜撰出来的，同是很多“当代岛国人”的想法。
最后艾伦描述自由的原话
“把海对面的人都杀光，我们是不是就得到自由了呢”"
芦哲峰,5,2019-07-30 18:02:08,337,历史哪有真相，端看什么立场。所以都在攫取权力，有了权力，就可以篡改历史，按照自己的立场重新编辑。前两季只是“燃”，拍到第三季，深度都有了，诚如大家所言，此片可以封神了。
洛圣都的猫,5,2019-04-29 02:34:21,532,四月霸权番
咖啡只喝速溶,5,2019-04-29 17:58:34,410,为什么不直接叫第四季？
包包白,5,2019-06-04 12:50:52,355,埃尔文和阿明之间的选择。。。巅峰！！
Chaos,5,2019-04-29 10:27:47,419,第一集就这么燃，人生头一次想让别人给我剧透。
老K特别冒险,5,2019-04-29 15:27:36,279,"来了老弟！兵长要和猴子开打啦！
人还是要有梦想的，因为没有梦想信念的人走不到最后，兵长大人连小针针都不会给你打~"
Honey&Clover~,5,2019-05-20 12:37:30,458,这作品大概要名留史册了
你不知道的事,5,2019-06-03 19:47:31,383,"白夜这一集是第三季最为感触的一集，人性最为挣扎与至暗抉择的一集。一边是具有丰富领导经验的兵团之魂，一边是洞悉全局的战略天才，从利益角度选择都尤为艰难，何况还要掺杂于个人感情。在这里死去其实是脱离苦海，而活着则是遁入炼狱。

地下室:每周更一集实在太难熬了啊，而且只有20分钟，再水点两三分钟的，基本一眨眼就没了，地下室这集剧情拖的格外明显，说是去地下室也就进了个地下室的门就没了...

最终集:这一集越发的看出少数人真的能决定多数人的思想和意识形态，当众人看见大海惊讶，利威尔兵长怕水有毒时，感觉心酸又无奈。让人联想到百年前闭关锁国的清朝，在看见西方坚船利炮时惊恐不已的表情。如果没有巨人之力，那对抗新科技的马莱帝国何等艰难。"
爬行钢炮,5,2019-06-18 08:06:33,256,最初看完第一季，其实感觉不太好，莫名其妙，而且男主像个脑残只会哭和问为什么。所以放下了很久。直到第三季开播，才无意间看了第二季，剧情突飞猛进，人物合理性也有了，每一集都无比抓人，接连不断的谜题把墙内的现实推进深渊，可又偶尔有光亮照进去。这样直到猛看完第三季part1，做梦一样不愿醒来。part2更是直指巨人史上最佳，每一集都把我炸成了花。随着艾尔迪亚人的历史被揭开，巨人想传达的信息更加明了。尽管暴力像人类文明的毒瘤，经久作痛，深受其害者人人得而诛之。但这个世界，在这个世界里窒息的我，都谈不上对和错。因为原来杀戮不是毒瘤，人性本身才是。今朝是你，明朝是我，刀子只是流转于不同人之手。如何直面残酷的人类史，在更广阔的意义上使人类整体从这个噩梦中惊醒，才是远超艾尔迪亚人与马莱人宿仇的问题。
赤朽叶流名,5,2019-05-02 11:50:17,177,奇行种真是越来越骚
我的团长我的团,5,2019-05-28 22:40:30,221,只有五星嘛，打出来像低分一样。。。
ONE,5,2019-05-09 14:00:32,300,去你妹的权游 还是巨人给力
qaq,5,2019-05-27 11:53:39,259,奈何本人没文化，一句卧槽行天下
Selene 葱,5,2019-06-18 16:59:07,215,就这样成为了利威尔粉丝团的粉头，为了下一季动画的制作质量我他妈愿意投资，我为自己居然看的是免费资源感到可耻，我何德何能能免费看这种作品。请有点素质乖乖打五星好吗？
黛玉晴雯子,5,2019-05-21 08:24:46,200,“这一切都没有意义，不管抱持什么梦想或希望，不管过上多幸福的人生，还是被岩石砸碎身体，都一样。人类总有一天会死，那么人生是毫无意义的吗？降生在这世上本身就是毫无意义的吗？死去的同伴也是吗？那些士兵的死，也是毫无意义的吗？不，不对！为那些士兵赋予生存意义的是我们，那些勇敢的死者，能够悼念他们的，是身为生者的我们！我们将会在这死去，将意义托付给下一个生存者，这正是唯一一个能够对付这残酷世界的方法。士兵们愤怒吧！士兵们高呼吧！士兵们战斗吧！” 枯惹
春夜血,5,2019-05-07 13:15:08,251,权游崩了，巨人依照原著世界观越来越大，却依然神作无疑。第一集简直节奏爆炸
十三th,5,2019-05-03 13:40:52,327,“这个制作组已经屌到让人觉得强悍是一件理所当然的事情了”
Momsenavy,5,2019-05-27 07:29:59,236,五星哪里够！！！！！！！为什么不能打十星！！！！！！！！这是十年来除了钢炼fa以外唯一能称得上神作的啊！！！！！！
阿基米德追上龟,5,2022-08-15 15:25:04,84,墙内的记忆可以被抹去，历史课本可被篡改，所谓真相在不同立场间也会大相径庭。
我只有吉他了🎸,5,2022-06-11 21:42:27,76,难怪可以拿几乎满分的分数。当剧情已经推进到墙外，众人完成了当初的目标时，更加宏大的压抑的世界观才慢慢展开，真相的揭露带来的是另一种窒息。可以说的是，这个故事里面的所有人都是悲剧性的，所有人都被迫在命运和历史规律的安排下，决定自己的人生。这种与真实历史高度契合的叙事真是太牛逼了。
Medicine,5,2019-05-01 09:15:29,193,想摁着所有人的脑袋 都给我去看 55555
迟与缓,5,2019-06-10 15:25:35,147,一念高墙成，一念百草生，百年笼中鸟，片刻自由人。
王小札,5,2021-01-30 15:59:29,76,巨人之真相篇。像一团烟花历经多年装火搓捻得以燃放的绚烂爆炸。玛利亚之墙夺回战的高潮段落臻于巅峰，甚连杀死角色的方式都令人唏嘘叹服。利威尔面临埃尔文与阿尔敏生死电车难题，在前者心念的地下室与后者向往的大海之间何去何从。小兵马尔洛赴死冲锋时想着希琪大概还在睡懒觉，应了可怜无定河边骨，犹是深闺梦里人。格里沙的前半生裹着自身的多舛命运随真相决堤而下。史书是真实历史还是当权者的工具呢，在是否要公布调查兵团取得的外界真相时，想起了理想国的洞穴隐喻。帕拉迪岛太像战后日本了，大陆的艾尔迪亚民族又杂糅了种族隔离，有时捕嗅到谏山创身上三岛由纪夫的碎片。艾伦从对巨人的仇恨到悲悯的蜕变。要杀光海对面的敌人吗，当自身的力量为世人所惧斥，是逃避偏安还是重蹈罪恶？这是一个问题。
陨落星辰,5,2019-06-04 11:12:15,174,太燃了这一季！团长那段堪称动漫史上的洗脑巅峰
不死鳥,5,2021-10-08 17:23:36,91,21世纪有什么二次元作品深度超过巨人的吗？没有。即便是那样子的结局。
哈莉露鸭,5,2022-05-22 20:37:25,64,我觉得论成熟度来说，这一part应该是整个系列里最优秀的。
Fleurs.哼哼,5,2019-07-24 21:14:40,81,"无论《自由之翼》的创作灵感来自何种文化，取材于哪段历史，嵌入了多少隐喻，鞭挞了多少现实。
它注定刻在了“伟大”上。
不客气的说，如果将动漫转化成文本，不敢说比肩“反乌托邦三部曲”，和权游过招也不落下风，特别是剧版烂尾的情况下那就是吊打了～"
不列颠之主,5,2019-06-07 01:28:34,125,目前已经补到了漫画最新话，用人格保证只要制作不出问题这一定是比肩eva，钢炼的神作
kiki,5,2019-04-29 17:55:44,150,就是里维士官长再厉害，也绝不是我们战士长的对手(◔◡◔)
雨过天晴,5,2019-05-27 20:27:28,152,今天这集的巨人把我震撼地鸡皮疙瘩掉一地，尽管早就看过了漫画，一往无前，愚蠢却又觉得为活着的人类付出有价值的新人兵团，答应团长杀了兽巨人愤怒值爆棚的兵长，从小梦想看到大海的爱尔敏为了打倒超大型巨人，情愿牺牲自己被烤成了木炭，就像他说的并没有输，因为我没有逃，啊啊啊怎么会有这么棒的神作！好想打100颗星
保持愤怒,5,2019-04-29 18:47:11,150,一击男出来挨打！！巨人绝对年度霸权预定！这样精彩的漫画再加上这么良心的动画组真是给全世界的福利了！虽说现在只看了一集但是全程热血沸腾，无论是kaji熟悉的嘶吼，阿尔敏灵活的小脑袋瓜还是兵长冷静利落的动作，当然还有调查兵团全员越来越熟练的战斗，都太他妈燃了！！！这样为了一部动漫热血沸腾的自己真是久违了呢。
月龄十四,5,2024-01-30 18:53:49,36,世界是残酷的。海的对面不是自由，是敌人。这一部分简直是史诗级的伟大，结束了闭塞的愚昧，又开启了无边无际的荒谬。每个人都应该有自己为之奋斗的目标，埃尔文团长是地下室中藏着的世界真相，阿卢敏是去墙外看海，艾伦是对巨人的仇恨，米卡莎是艾伦，但更多的人是相信自己是特殊的，结果却发现自己不过是世界的炮灰，然而即使是炮灰，也和某个人有着深厚的联系。
Doublebitch,5,2019-05-24 12:54:46,114,人类总有一天会死，那么人生就是毫无意义的吗？降生在这世上就是毫无意义的吗？死去的同伴也是毫无意义的吗？不，不对，为那些士兵赋予生存意义的是我们，那些勇敢的死者，那些可怜的死者，能够悼念他们的是身为生者的我们。我们将会在这死去，将意义托付给下一个生存者，这正是唯一能够对抗这残酷世界的方法。士兵们愤怒吧！士兵们高呼吧！士兵们战斗吧！
过河卒子,5,2020-04-20 23:28:50,65,"艾伦父亲留下的手记被打开那一瞬，我将永志难忘。此前五十余话力造的价值被全部粉碎——远非世界观的改变这么简单，而是情节行进、人物发展的内驱力和全心塑造出的意义由亲己之手一气推倒，在心头激起滔天巨浪，甚至让人难于呼吸。
之前看完EVA旧剧场版第二部，我说：“动画分有了此前由伟大文学享有的光荣”。而《进击的巨人》，则是享有了毫不输于任何一种艺术形式的，独属于动画的光荣。"
以有涯寻无涯,5,2019-05-20 18:52:57,63,和权游不同，一如既往的五星！
十八爷,5,2022-01-21 13:38:50,34,把“真相”看作唯一的希望，为了这个希望付出了无数人的绝望，最后找到的也不过是潘多拉的盒子。
nowhere,5,2019-06-10 12:38:44,82,"终于等来了地下室的真相。永远忘不了看漫画时候世界观从「地下室」那一章陡然扩大的震撼感。
真相过于沉重，想想之后的境况，难免想感叹要是你们不死死追寻多好，永远活在明确的奋斗中多好，但是人类追寻自由的心永远无法被禁锢。
丢掉自由就是自由的方法。"
譬如朝露,5,2019-06-10 18:10:07,81,"不用播完，看了目前这几集怎么也得满分了。
用个比喻的话，《进击的巨人》就像是别人家的孩子，科科优秀，无疑已经是这个时代日本动漫的最好作品。《攻壳机动队》《回忆三部曲》这种打小爱思考的哲学少年不会再出现在这个时代，《星际牛仔》《混沌武士》这种潇洒写意的天才型选手也不会再出现在这个时代，《一拳超人》这种体育特长生总是不稳定，第二季就像身体条件还在但上了高中就抽烟喝酒不训练的劣迹运动员，掩盖不了全优生的光辉。"
rmqlife,5,2021-01-31 12:06:09,53,之前朋友说进巨是哲学漫，我没懂。后几集抖了包袱，把前面三季的明喻暗喻看明白了，才明白此言非虚。楚门的世界里，你选择无知的快乐；还是自由的痛苦？
嘿嘿嘿,5,2019-06-09 12:12:16,129,一向自命清高的豆瓣评分居然高达9.8分！这真不是B站评分么？【滑稽】
q,5,2019-07-08 22:51:37,88,确实是巨人系列的巅峰之作。
思路乐,5,2019-07-16 21:17:01,42,【A+】谏山创在原作所编写的震撼剧情，动画组在视听上超凡的表现，还有声优们超水准的翻译，让第三季part2成为了足以留名日本动画史的作品。前半段玛利亚之墙夺回战应该算是动画史上最惨烈的战役之一了吧，谏山创发起狠来真是毫不手软，而动画组的氛围营造与声优演出也让第十八集完全超越了漫画原作的表现力。后期真相的揭露也真是足够震撼，一切的起因，竟然只是一次自由的追寻。海的那边没有自由，有的，只是立场不同的敌人。
苏案,5,2023-01-22 14:00:26,27,继女体巨人后又一个令我屏息的情节段落。玛丽亚之墙夺还之战太好看了，太精彩了。而且参与这场战争的每个人，无论是所谓的正反派，是主角还是背景板，都有他存在的意义。几次攻防转换，背水一战，牺牲与成全，遗憾与解脱。牺牲者的意义由后来者所书写。若为自由故，“每次想到大海，我的内心就充满勇气”。大海是给勇敢者的奖赏。但大海还是有边际的，海的那边，究竟是不是你渴望的远方。故事整个世界观的架构也在最后揭晓，一点都没有让我失望，你几乎可以从这个架构中解读出你想要解读的关于现实世界的任何隐喻。一切故事都是人与人的故事。
一心而用,5,2019-07-01 18:09:32,68,玛利亚之墙夺还战篇是全作目前的高峰，除了点题的那一话做的不够理想外，wit社做到了对原作120%的还原，对其自然如何赞美都不为过。对原作的评价很多时候不是“真是精彩！”而是“居然还能这么精彩？”。引用句话来说就是：巨人从第一季时就是神作了，之后只是在不断刷新“神作”的上限而已。因为之后的剧情无论是紧张程度、争议程度还是残酷程度与之前相比都是有过之而无不及，作为迄今为止剧本完成度最高的青年漫（可能没有之一），如何成功收尾也令人无比担忧。希望wit社能把最终季平稳地做下去，然后等着被载入史册。
Sola,5,2019-04-29 03:02:34,43,不负众望
vyan,5,2019-05-29 10:41:28,57,我们时代的EVA。
无属格从句,5,2019-07-09 00:42:48,31,墙内的青年以为靠一套启蒙叙事（自由）和大和民族梦（“看海”）就能过上自给自足的、井然有序的中世纪田园牧歌生活——这难道不已经有着内在的锚裂吗？走出墙外了。在海的另一边等待着他们的是一个现代工业文明，是你死我活的霍布斯时刻。人与人之间的战争，而非人对巨人的英雄式抵抗。我们将呼唤不死的弥赛亚。13年的誓期，无人得救。
第三螺旋,5,2019-07-03 09:02:02,32,跨过墙，也跨不过立场。全剧都是各种悲剧，主角以为的正义战争，真相是朋友相残、亲人相残、同胞相食
Huanghehaohl,5,2019-05-26 21:06:43,88,"还有不给5星的人？？？
巨人的世界是残酷的，他残酷的地方在于把大多数龙套都塑造得有血有肉，会害怕，会兴奋，会为了理想即使恐惧到呕吐也会向野兽巨人发动自杀式冲锋。他们就像一个个生活中能见到的最真实的人，然后一个个惨死在你面前。
但是如果没有兵长，他们的死有什么意义？
他们是值得尊敬的战士，但确实，如果没有兵长，他们的死亡没有意义。"
轩辕十四,5,2019-05-06 19:27:51,50,不谢 www.yxdm.tv
momo,5,2019-05-21 01:18:09,57,吹爆玛利亚夺还！辣鸡猴子还我团长啊！
marumaru,5,2019-07-22 19:44:25,40,"论干脆利落地杀死笔下角色的，我只服西马丁东山哥……
各种隐喻剧情也太高能了吧！主角在残酷的世界里一层层的自我怀疑自我剖析，在向死的无意义中探寻生的意义。
引以为豪的民族神话实则暧昧不清；
自以为是被神选中的幸存者，却被称为恶魔；
以为杀戮巨人是为了保护，其实杀死的是天各一方的同族；
以为死亡永远不会降临只是酒桌上的谈资与日后勋章上的装饰，却是转瞬即至；
以为坚定的信仰，脆弱的不堪一击；
被称为“父亲”之人，却一次次把孩子作为复仇的工具。
散落的遗民或是狂热皈依，或是执着复国，所背负的祖先罪恶
热血、激情、冲动、大义名分，一切仿佛都是无意义的，只等待后人如何去记忆去传承。
这一季看完，真是发自内心地深深爱上了兵长～"
小药水,5,2019-07-14 18:25:10,34,讲了6年的故事，这一季的战斗真的太牛逼了....荡气回肠，同样身处高墙之中的我们，又可以为了真相和自由，奋战到何种程度。
塔塔君Minkun,5,2019-07-12 17:33:48,16,不得不被折服。第三季P2前半部是对前面的定调作最后一次高潮，之后便钻入被嵌套的最小化之中，对回忆与当下交互剪辑的城郭里有地下室，地下室中藏有来自另一个世界的记忆——照片，照片将两个不同时间的空间、世界联结。躁动与寂静、最大与最小的恢宏、奇异的切换，亦让这一篇章成为整个作品最令人动容之一章。
momo,5,2019-12-09 13:06:50,78,"太，牛，逼，了。真的过于牛逼了，五星根本不够。每一次联系到八百年前的伏笔都让我下巴都惊掉了，光是这就甩了99%的作品一大截了。真相再一次褪去外衣，接近更核心的部分，整个世界越是明朗就越是残酷。从「勇者」到「白夜」太牛逼了，真的是史诗级文戏。前两季时我曾经觉得团长像美队，到这一季才发现完全不是一个层次的人物，团长前期神性越突出，暴露出人性的本心时就越是令人震撼，完全超脱了漫画人物，完全就是一个活生生的人坐在那里。看海是多么美好的向往，但赎罪性质的探究真相，该是多么的深刻，以至于占据了从骨到心的整场人生。所以对你充满指望期待的人永远希望你再负一次责任。只有爱你的人才会希望拿走你肩上的负重，让你安眠。"
汪汪雪冰,5,2022-09-14 02:06:28,20,想给阿尔敏点播一首《想去海边》
-0brian0-,5,2019-06-03 13:45:35,114,万万没想到最感动的居然不是“勇士”，而是“白夜”
葡萄藤下,5,2019-06-17 14:40:09,63,有朝一日马丁亲自撰写出“人类与异鬼的决战”，水准也未必能超出其上。
Alain,5,2021-03-27 18:29:56,9,感觉收尾在看海就完美了！
怀谨握瑜,5,2023-11-09 18:32:06,17,"终于来到地下室 世界观展开后，主角们设定都更像反派了"
Vendetta Child,5,2019-07-13 19:51:21,42,热血少年的开篇终成饱含政治寓意的神作。力量亦原罪，乐园亦牢笼，同胞亦天敌，自由亦战争。怀璧其罪的艾尔迪亚人离开乐园又终将去向何处。
Fchwpo,5,2021-02-05 00:58:31,34,那次冲锋是动漫史上最惨烈的牺牲
零叁,5,2019-06-17 21:42:35,63,真牛逼啊，我见证了一部神作的诞生，它完全有资格在世界影史上占有一席之地，并与那些能让我们如数家珍的伟大作品平起平坐。
毛秃秃和胖咕咕,5,2021-04-10 19:59:41,18,艾伦指着大海，海的对面是什么？可惜的是，作者谏山创于那之后突然猝死，只留下了一个这样令人震撼的开放性结局，埃尔文团长的献出心脏，兵长砍猴和自由之翼已经成为我心中动漫史上最闪耀的高光。而对于以后有人冒用谏山创之名狗尾续貂的内容，我们应该予以坚决的无视，就当它不存在。
Rembrandt,5,2020-03-19 00:41:19,33,本季值得被载入动画史册。
Mrbikong,5,2022-09-20 01:02:17,36,光临 白夜 地下室 太牛了 海的对面是敌人，他是被送到乐园的我们的同胞…感觉死于梦想门前最后一步的团长何尝不是最幸福的人，他近乎是耀武扬威般地炫耀了李伟留给他的最后一份温柔的私心，不会陷入这破烂不堪的真相里无法释怀……听到李伟那句放弃你的梦想去死吧，团长脸上露出的是从未有过的 终于被人理解后的无限温柔与释怀，和李伟确认故人已去后露出的从未有过的脆弱与痛苦相得益彰，妙啊！还真是 早点死就不怕作者乱写发疯了🙏死了的都是白月光，永远年轻永远智慧，永远温柔永远塔塔开……
