username,rating,time,votes,comment
多拉西,5,2020-08-16 16:52:05,5,善与恶的对立被打破 无人有罪却又共同承担着痛苦 说到底还是人性所至 放眼现实也同样如此 所谓对自由的追求 究竟什么才是自由 为之付出的代价是否对等 对意义的探讨也同样深刻 团长的最后一段话 死都是没有意义的 需要后人来为自己赋予意义 以此代代相传 一步步缩小与真相的距离 然而真相却更加残酷 要为前人的牺牲赋予意义恐怕需要的是更多的牺牲 说到底一切依旧没有意义 第一次希望动漫文学化 在现有世界架构＋存在主义内核＋多元人物塑造的基础上进行深入书写 定会成为经典 //看到阿明牺牲自己真是哭成狗 团长放弃实现执着一生的个人理想悲壮牺牲也好唏嘘 哎为什么人类的历史尽是互相厮杀 过去发生的当下亲历的未来注定的 真的没有意义
zhang 2nd,4,2020-05-29 16:13:07,0,这才真正展开了
愛月撤灯,5,2020-12-07 09:06:01,12,那一天，太阳没有落下，于是第二天，黎明没有来临。致55话白夜。
Johnsu,5,2019-06-15 17:56:52,18,这季的19集，最后耶格尔医生说到希望拿到这本日记的是我的同胞时有点想哭呢。这是为什么呢？
Aguai,5,2020-12-15 20:38:38,4,「妻子也好，孩子也好，其他人也好，要在墙内去爱别人，如果做不到就只会和过去一样，无数次重演历史，重蹈覆辙，如果想拯救三笠，拯救阿尔敏，拯救大家，就去完成使命吧」
幻觉共有,5,2019-07-20 04:45:18,5,从第一季第一集开始看 本来以为只是热血战斗番 远远低估了作者的立意 完成度太高了 是我看过的最好的动画之一（原作是漫画）
一条瑜评动画,5,2019-04-29 15:51:03,7,有生之年，五星为敬
Tom,4,2021-04-28 23:26:37,0,到第三季为止基本上把整个世界观构筑完整了，强烈的社会和政治隐喻、投射出的历史观也达到了一个顶峰。
silver,5,2019-07-02 11:13:23,25,希望大家举报那些恶意评低分的人，评一星的您真的看了吗就在这找存在感ps.仅针对第三季😁
普罗米方舟,5,2020-11-30 22:01:29,1,毫无疑问本月的观影是属于进击的巨人的！！这部动漫实在是太顶了！！！！我要毫不吝惜地把所有的赞美都给进击的巨人！他让我仿佛找回了当年看海贼王的那种感动和热血，但他又是完全不同于海贼王的动漫，日漫里进击的巨人可以直接在我心中和海贼王并列第一了！这是一部非常不像日漫的日漫，各方面和德国和欧洲有着千丝万缕的联系。悲壮的配乐、丰满立体的人物形象、极强的故事剧情、上乘的动画制作水平、作者涉猎广泛的议题探讨、对复杂人性的思考等等，在我心中这部动漫已经封神！他让我无数次热烈盈眶！进击的巨人，我把心脏献给你！Shinzou wo Sasageyo！！
Harvest,5,2019-05-02 17:53:44,15,做到现在都没有明显下滑，我感觉进巨要封神了。还有九集要追，心脏且留下，五星拿去！
听霜书生,5,2020-12-07 16:05:06,0,听说今天要第四季了，有点激动……回来发现之前看了没标记这个。
猫猫少将,5,2019-06-10 13:25:02,8,以前真是不懂欣赏啊。。真是个好题材，泪了
沈枯燥在搞文化,5,2022-04-12 18:00:43,3,兵长的选择那集 泪流满面
momo,5,2019-06-03 17:30:39,12,不用走程序，直接吹爆。剧情，动作，人物塑造，构图，台词，音乐全部满分，不打五星还是人吗！
UrthónaD'Mors,4,2021-06-22 14:49:00,0,奇行种的狂欢
风尘,5,2019-07-05 12:39:22,4,"4.5
一直在追寻大海那边的彼岸
可真的了解到，才发现那里
不是桃花源，也没有自由
这里人的意义，也只是存在于用自己的死亡，将生的希望就给后代
士兵们，愤怒吧，士兵们，咆哮吧
士兵们，战斗吧，士兵们，前进吧
士兵们，接受死亡吧"
NGL自治国蚁王,5,2019-10-23 00:57:19,7,敞开心扉，非常舒适，墙内人看见了目标，故事可以向着海外边的敌人发展了，观感渐入佳境，但是由衷希望nc粉少一点，真心别给巨人招黑好吗？比巨人好看的番多得是
欧依熙,5,2023-11-16 17:20:39,0,“阿尔敏，把大海对岸的敌人都杀光，我们就能获得自由吗？”
半弦月,3,2020-05-02 22:20:22,7,全仰仗文本拓展，其实很惊艳，这世界观控制不好容易崩
岛屿森林,5,2019-06-24 13:03:59,15,虽然看过漫画，但21集还是让人起鸡皮疙瘩。每个继承巨人之力的人，都会继承之前所有人的记忆片段，但是可能不知道是谁的记忆。枭在为艾伦爸爸注射巨人脊髓液时说了段话，让我觉得进击的巨人应该是一个轮回的故事吧。艾伦一直想救大家，但是没有做到，所以通过某种方法，也许是始祖巨人的力量，也许是集齐9大巨人的力量，将时间变到了10岁时还没有被巨人袭击的时候。。。最新一集正好与第一季第一集开始呼应，艾伦梦到巨人，从梦里醒来，说做了一个很长的梦。。。啊啊啊啊，漫画什么时候更新啊。。。
Panda的影音,5,2020-12-03 23:45:11,2,就这么继续偏爱动画下去吧！—— EP4→艾爾文團長：…為那些士兵賦予生存意義的是我們！那些勇敢的死者，那些可憐的死者，能夠悼念他們的，是身為生者的我們。我們將會在這死去，將意義託付給下一個生存者，這正是唯一一個能夠對抗這殘酷世界的方法。—— EP9→艾連·克魯格：“九大巨人”分別有自己的名字，接下來要由你繼承的巨人也是。這個巨人無論在什麼時代，都為了追求自由而不斷前進，為自由而戰。其名為，進擊的巨人。& 致 親愛的希絲特莉亞：現在萊納在我旁邊，正在偷看我寫這封情書，真是個沒品的傢伙，他絕對不受女孩歡迎。但他跟我約好一定會把這封信交給妳，說是想報答我那時救了他們的恩情。那時候真的很抱歉，沒想到我比起妳竟然選擇了他們。我將要赴死，但我不後悔。雖然很想這麼說，但其實我還有個遺憾，那就是沒能跟妳結婚。尤米爾 筆
进羽,3,2019-05-06 16:13:50,2,这一季主要是讲玛利亚之墙外围的作战，以及地下室的秘密。因为看过了漫画，所以没有很激动的感觉。
积木,5,2019-06-27 12:05:28,10,脉络越来越清晰了。还不想看漫画，感觉剧情会飞快接受不了
麦田守望者,5,2019-07-17 06:02:49,3,日本人真是一点都不避讳有法西斯倾向的装扮啊……但是我还是觉得是个可歌可泣的好作品。没有看过原作，但动画组干净利落。但我还是觉得莱那的戏份有点多，虽然他精神分裂了……
破忒头,5,2019-05-16 15:31:21,20,以前巨人霸权的时候纯粹当热血民工漫来看，事实证明这是最错误的打开方式。二刷我才注意到艾伦以外的其他角色。谏山创到底是个什么品种的神人，挖坑必填，从第一话开始每一个分镜都有可能是伏笔，对战争、信念、人性提出太多哲学问题，我经常要停下来思考很久才能继续看，respect，日本漫画史巨人必须有姓名。动画方音乐诚意实在太足了。
雨碎风希,5,2019-06-24 11:39:22,11,剧情紧凑不拖沓，立意很深，文戏高潮迭起，武戏帅出天际，还能说什么呢，迄今为止看过相当好的作品了
tobeelva,5,2019-06-04 10:29:25,10,深挖人性的巅峰之作
索,5,2021-04-10 21:12:01,2,这一季是最精彩的，堪称完美
Horace,5,2019-07-03 08:48:48,5,为了我的梦想去死吧。
[未注销],4,2025-03-05 07:17:52,1,在山的那边，海的那边
在路上,5,2019-05-06 21:12:56,18,权游血崩还有你
樗栎,5,2019-06-24 13:00:51,14,我给很多作品打过五颗星，唯独这个，我想打六颗。
顾轻舟Jasmine~,5,2019-06-10 15:08:58,22,"这就是真正的人类吧
永远心怀梦想
永远追求自由
永远不会屈服
甚至主动选择死亡
这就是人类能拥有的勇气吧"
馨馨家的霸王龙,5,2019-06-03 23:50:52,12,“放弃你的梦想 然后去死吧！”
小王子,5,2021-02-08 20:34:24,0,没想到第三季这么惨烈，但是第三季也是闪现着人性光辉的一季，巨人的真相基本上已经全部揭晓，每一个离去和留下的人都刻画的很有灵魂。让人意难平的是埃尔文团长，一路走好。
小点点,5,2019-05-28 00:49:12,10,燃死我。 卧槽 兵长太几把帅了 给我砍砍砍。 终于理解广电为什么要禁了 ，砍起来不要太爽。结合今天南昌的新闻 ，禁了的话 就少了一帮傻逼看也挺好的。
Dream-Sky,5,2019-05-27 22:30:00,6,目前看过的动画的巅峰
豆友2174522,5,2019-07-01 22:14:35,0,#柒捌捌〇看动画#我想在今天来看这个结局，多少有些脚注的意味。“我以为海的那边是自由，而其实那边是敌人。”
Turefixfans,5,2019-07-03 00:09:51,16,"核心渐渐转到史、哲、政
真是把故事越讲越好的典范
日漫的思想水平和制作精良度逐渐向美剧并齐
我们要等到什么时候才能有这种级别的作品"
paracelsus,4,2024-03-19 01:25:45,0,4.5
LLENN,5,2020-02-20 15:38:55,8,进击的巨人是我看过最好看的动漫和漫画了，虽然前有海贼王，后有鬼灭之刃，但是仔细一回想还是进击的巨人最棒！
郭连凯,5,2021-02-19 02:38:52,0,ok
白垩纪,5,2019-05-23 13:08:48,13,#玛利亚之墙夺回篇不可战胜#“人总有一天会死，那么人生是毫无意义的吗？降生在这世上本就是毫无意义的吗？死去的同伴们也是吗？那些士兵的死也是毫无意义的吗？不，不对！为那些士兵赋予生存意义的是我们。那些勇敢的死者，那些可怜的死者。能够悼念他们的是身为生者的我们。我们将会在这里死去，将意义托付给下一个生存者。这正是唯一一个，能够对抗这残酷世界的方法！”——埃尔文·史密斯
林摸鱼,5,2019-07-06 09:02:01,4,当初看漫画时，比起墙外异世界的设定，最为悲壮感怀的，还是兵团二人最后的意志。调查兵团也冲到了头，自此，自由之战完结，余下的，就只是无休止的战争了。
Asteroid,5,2019-06-11 17:10:12,18,太 无 敌 了 我 操
君心可晴,5,2021-03-02 20:28:20,3,原著中，最精彩的一段，动画版依然也是最好看的，那么多人献出了心脏，谜底也同时揭开，超级震撼。……进行到这个时候，之前的设定bug，一个个也凸显出来，瑕不掩瑜，创作了那么久，可以理解为，开始创作的时候，还没想到后面。
Serenais33,5,2019-10-03 19:43:29,7,就喜欢从来不嘴炮的兵长 快狠准
Fenriz,5,2019-06-05 21:55:28,6,深刻诠释了有个好剧本就算放ppt也好看，不过这部貌似制作经费不太够，人物的脸偶尔要崩，好出戏……
Reddie>///<,5,2019-07-18 03:15:11,10,"恭喜巨人在我心中荣升到与三体和龙族齐平的地位 花了两周时间把巨人的漫画 包括前传全给追完了 真的对创哥跪得膝盖都要跪碎了orz 原来墙外的世界是那么广阔啊 原来除了血腥的杀戮还有一丝温情啊 原来进巨是一部励志无比的热血番啊 漫画看完完全颠覆我对巨人的固有认知了
第三季part 2的动画也是强无敌 前几集能把权游从IMDB上拉下来 人物刻画细节无与伦比 文戏白夜一集无OP无bgm全声优控场堪称动画史上的典范 武戏兵长砍猴酣畅淋漓让人高呼牛逼 哇进巨就是给人那种对自由对希望对未来的向往 被碾压那就想尽一切办法去战胜比自己强的多的怪物 被人夺取记忆那就去找回那些丢失的历史 被束缚在牢笼中就更加要去新世界寻找自由 献出自己的心脏 去探寻世界的真相 这就是调查兵团啊 我已经激动得不知道怎么评价了😭"
颍原真吾,5,2019-07-01 10:02:38,6,不，不对！为那些士兵赋予生存意义的是我们，那些勇敢的死者，能够悼念他们的是身为生者的我们。我们将会在这死去，将意义托付给下一个生存者，这正是唯一一个能够对抗这残酷世界的方法。
明天就现充,4,2019-07-08 14:16:29,2,四星半。E4-6完全值五星，可是这网越撒越大让人不禁担忧最终季怎么收
Chain,5,2021-03-22 15:19:11,0,此时时刻，明知自己会在此处赴死，毫无意义地、毫无生息地、死去！很害怕无意义的死？不，是否有意义是活着的人赋予死者的。
Azeril,5,2019-08-04 02:02:03,3,下篇。围绕城墙夺回战和地下室秘密探索展开。而最终所触及的则是整个大陆的秘密 被篡改的记忆所掩盖的真实世界 终于在百年之后展现在围墙中的所有人眼前。在大海对岸 并非是希望 而是敌人。剧情方面 最扣人心弦的是兵长手握巨人药剂 在一众人的争执乃至对抗之下 选择救谁。期待下一季
momo,5,2022-11-12 20:29:36,8,越长大越能理解艾尔文和古力夏了，其实作者的表达很明确，“只有恶魔才能战胜恶魔”，人活一世，为自由、为正义、为真相，终将归于虚妄，支持这副身体继续苟延残喘的，唯有心中的执念而已。为了执念放弃一切，至死不渝，浓墨重彩地活过一生，将其他人甚至自己都视为棋子，只为了自己内心的真理，哪怕众叛亲离，失去生命。过去的古力夏，今天的团长，未来的艾伦。然而兵长在最后关头选择复活阿尔敏，从此人类的命运产生变数，因为兵长和阿尔敏一样，完全不是恶魔，而是被情感牵绊的普通人，他们心中有对美好的向往，有对人性的期待，但这些东西到底能否存在，谁又知道呢。这么一来，我算是理解红毛为什么是团长和艾伦的死忠粉了，如果这个世界是地狱的话，可能我们不需要天使，更得不到和平，只需要一个恶魔带领，去用绝对的力量改写世界的规则吧！
💥,5,2019-05-06 02:07:25,59,网盘黑马来了
Kalsarikkkk,5,2019-06-04 17:00:49,9,看到了希望和绝望的并存，感受到活下去的力量，也知道死亡的降临。我们为什么而存在，我们存在的意义？埃尔文给的回答是：自由的。死者的意义是为了寄托给下一个生者的。5星的神作，像在绝壁上的雷炮，砸开了整个岩洞，全人类被灼烧吧，呐喊吧，反抗吧，战斗吧。像整个历史浩劫的缩影，在残酷的利刃中，看着自己同伴倒下，看着自己倒下，最终用鲜血铸成的［消失的历史］回想第一季，如百年孤独一样的开头，＂人类在那一天终于想起被巨人支配的恐惧。＂什么都是无解的，士兵最终会倒下，坟墓会腐烂，文明被瓦解。有一天，人类又重蹈覆辙的在忘记的基础上，苏醒。
甚天,5,2023-05-01 22:25:06,2,"3：没有一个情节多余，世界线收束，马克的死和疯了的莱纳；4：石沙变血雾，后来的生者决定牺牲者的意义，冲锋吧呐喊吧战斗吧；5：'勇者'敢死队，“和父亲不一样”，兵长赛高，“我没有逃”；6：“我们都是那个父亲的受害者”，尤弥尔的信，阿尔敏，埃尔文，恶魔，大海，“老师,你怎么知道墙外没有人类了”，“大家,救救我”；7：众人正沉浸在深情与悲伤中，沙夏“吵死了！”，他们成功去地下室了团长；8：我要疯了；9：三笠和阿尔敏；10：是敌人还是自由"
💥,5,2019-06-17 14:45:34,19,不给五星的都是不客观评价
执空,5,2022-04-23 16:08:55,6,这一季出彩的人设也太多了。比如愿意和民众共享信息的女王（ORZ，疫情当下的上海刚刚经历了全网的404，说到这个真的是讽刺），至死都在追求梦想的艾尔文团长，为了自己的使命放弃自我追求的艾尔文在濒死的一刻举起手来提问真的太让人动容了，为了履行团长的承诺杀了一排巨人的兵长真的是帅到爆，兵长真的是人类之光，凭借人类之力杀了巨人。还有阿明绝对优势的脑子，观察力推断力以及最后的赴死，绝对是第三季高光时刻。在最后也终于埋下了艾伦的激进主义的伏笔，如果艾伦真的能看到未来，他的确是会认为，和平是短暂的，而只要人类在，掠夺有限资源的目的在，战争就永远在。
堰赞咔,5,2019-05-27 10:39:42,6,"团长下线，阿尔敏下线
哭泣
卧槽？这边还经历了这种事？不是第五集之后就完？"
浅蛰「已注销」,5,2019-07-01 12:55:24,13,"进击的巨人的两大难题：
格里沙的“究竟是谁错了，是我还是这个世界？”
艾尔文的“老师，墙外面没有人类的事，是怎么调查出来的？”"
Jin,4,2022-10-23 05:37:51,0,「地狱会一直存在直到我们死绝」
粟冰箱,5,2019-07-07 15:14:56,8,世界观终于揭开了全貌，设定太棒啦！！17集看得我痛哭失声，好久没看影视剧这样狠戳我心了。每个人物都有沉醉的让自己活下去的一件事啊，包括肯尼，包括埃尔文团长，包括猿巨人……太惨烈了。不过唯一安慰的是，他们最终都看见了海啊。
闲,5,2019-05-28 20:31:22,8,这个弥补了权游烂尾的遗憾
玲玖,5,2020-01-11 01:12:51,6,如果有人质疑动画不能打 不够别的艺术伟大 这几集是最好的打脸工具
屹青,5,2022-04-10 16:53:52,1,塔塔开！！
梁仲雨,5,2019-05-27 20:01:02,9,吹爆本季第五集，虽千万人吾亦往矣，本剧最高潮之一。
猫日那,5,2025-03-04 22:15:44,2,玛丽亚之墙夺还战赛高！总算到海边了，但海的那边，真的有自由吗？
未检测到人脸,5,2024-03-18 21:53:01,0,长评。
王大pants,5,2020-05-09 21:11:51,8,这他妈就是时代神作
叫我垃圾君,5,2019-06-05 07:42:55,10,看完第三季之后你应该只有一个要求，想看第四季。
我好苏啊,5,2024-06-18 16:35:24,0,团——长———！太惨烈，使我的眼泪喷涌
连虎修,5,2021-01-25 21:17:38,0,我大呼牛逼
SitStill,5,2019-05-28 21:15:34,4,卧槽 第17集屌爆了！！！
齐木楠子,4,2022-12-14 16:24:45,1,我的艾尔文团长啊啊啊啊！哭勒！利威尔真的好厉害…哭勒
popon pop,5,2024-10-01 14:49:58,4,之前我发错了我其实才看完第三季…是真的好看的。完了我已经不讨厌艾连和三笠了，对不起我打脸了，这里世界观的不统一性不断在内部不断反思和架构，然后向深处一直幽微而仔细的探索真的是好作品基本面貌！学习了
东桑桥南,5,2019-09-01 16:37:32,5,电车困境做最后的选择难免有点理由不足；困住人的从来不是墙；从来没有真相；最后会有那几种声音呢
niche,5,2019-06-17 18:02:50,16,他的名字叫:进击的巨人
sin狗,3,2019-05-25 09:54:15,4,题材很好，但实在受不了日漫这种中二的气质。。
欲圣,5,2020-08-31 20:21:22,3,“世界残酷而美丽，让共同降生于世的我们——互相理解、一同欢笑、并肩前行吧。”
白日梦想猪,5,2019-06-03 11:38:27,21,我的妈，s3part2大概就比权游最终季好看个几十倍吧！
折木,5,2022-11-19 00:52:51,2,海的那边，是敵人。
子非鱼,5,2019-10-15 13:15:15,5,"确实牛逼但没到我心目中能封神的程度，格局也并不出乎意料。另外也许动画时长受限，总感觉一些串联剧情的细节仍旧不够充分，看来要补补漫画。
这部分最打动我的是结尾艾伦那悲哀的反问，那是他成长的见证，也是对“自由”的更深领悟。
ps:维利兵长的无敌实力真是如同bug般的存在……"
ccc,5,2019-05-03 11:14:48,9,大爷就是大爷
東郷柏,5,2019-06-30 10:38:48,12,8.5 从13年第一季到现在确实走过了一段漫长而激动人心的旅程 第三季P2是这个系列目前我最喜欢的；团长不动如山的威严淡化了调查军团的玉碎的悲壮 而在团长与阿尔敏之间的选择也不落俗套地表现出了人在艰难抉择中的困境 而如何评价团长短暂的一生呢？我想没有比「自由」与「勇气」更贴切了；壁の向こう何があるか？海か 自由か？一緒に行ってみよう；この世界は残酷だ あなたそれにどう向き合うか？飲み込まれるか もしくは立ちあがるか？如果明知墙外是更危险的世界 你是否有勇气义无反顾踏上那追寻充满荆棘的自由之路？目前这分数不知要垄断豆瓣最高动画评分多少年
西凉虫,5,2022-04-01 22:08:34,4,海的那边，是敌人!
芥末蘸酱,5,2019-07-04 21:25:38,4,格局一下子就起来了。
土豆,5,2021-01-14 21:15:41,9,"一切的疑问在这一季都找到了答案。 那些你曾经无比憎恨，发誓要全部杀干净的巨人们不过是被杀害的无辜同胞，一群可怜人；你们终于见到了大海，但海的那一边不是你们向往的自由，而是势不两立的敌人；你引以为傲并不惜献出生命的精英调查兵团不过是墙里国王用来圆谎的棋子，所有的牺牲都变得没有意义；你所信仰的一切都是假的，墙里的人在谎言里生活了一百多年。  谏山创的这部作品有别于传统日漫，他用自己的艺术特质给这部作品增加了文学性，这个世界本就不是小孩子眼中非黑即白的二元世界，所以整部剧里没有特定的好人和坏人，但墙里面的人跟外面的人又无法和谐共存，这又是一个无法调和的矛盾，所以就注定了这部剧的悲剧性。一部伟大的作品的共性就是每个人都可以根据自己的经历和认知从不同的角度读出不同的内容，很明显，进击的巨人做到了。"
欧普我米,5,2022-05-15 21:54:36,3,可明明胜利那么近，近到唾手可得，但如同每一次一样，不留情面用你最熟悉的方式对你报以重击。然而就在这一刻，总有那样一丝火焰燃起，燃到希望重启，即便回到原点也坚信胜利越来越近。这一季无疑是最为惨烈的，团长的抱憾离去，调查兵团的几近团灭，人类是那么的渺小无助。但夺取超大型巨人的能力，地下室的秘密，以及夺回玛利亚之墙，又让你觉得，人类终于胜利了。这样起起伏伏，反反复复，这部作品便成为了神作。而人类与人类间的斗争真相也逐渐展露了端倪。
影启缘末,5,2019-07-01 19:32:46,5,神作都结束了我工作还没定。。。
干煸鸡丁,5,2019-07-01 15:34:56,15,第三季正式完结。整体把控得太好了，充斥着古典的美感。绝望，黑暗，破烂不堪，希望的火苗忽亮忽暗。放过了一直向墙内爬行的无垢巨人，艾伦真正有了神明的感觉。向往自由的人们，终于去往墙外，去看燃烧的水，结冰的大地，风沙的雪原，还有无边无际的海洋。一部伟大的，城墙内外的，人类史诗。
glow,5,2019-07-02 10:58:35,5,"不接受任何差评！！！！
咋十集就没了？？还得等一年啊啊

哭！！！！"
轻浮玻璃罐,5,2021-01-09 22:51:03,6,以为PTSD老早好了，然而只要一碰白夜及任何相关还会不可抑制抽搐起来，就一个行走活白夜梦魇er，刀刀是豁口
最后一代_冷雨,5,2019-07-01 23:38:51,6,愿他们残酷  但是永远正义
直布罗陀岩石,5,2019-07-10 11:04:26,5,画卷终于展开，世界的全貌终于豁然开朗，所有的墙不过是自欺欺人，所有的巨兽不过是人类自己，终于走到海边，终于要开启反攻的大战，可是依然分不清谁才是正义，什么才是自由。
Bull,5,2019-05-27 16:17:19,9,80年代有城市猎人，90年代有龙珠灌篮，00年代有海贼，10年代有巨人， 跨时代的神作，吹爆我巨人！
饭夫斯基,5,2020-06-29 02:53:20,3,Armin被火烧那段我直接暴风哭泣出声
Johnny Fung,5,2021-02-18 17:57:42,3,太炸了。反战题材能做到如此优秀，期待最终季。
利威尔,5,2019-04-29 02:36:52,7,巨人让我体会到了搞top的快乐，你爷爷永远是你爷爷！！！！无脑一分的死🐴了
苏乏,5,2019-05-10 16:39:33,4,吹爆
昏金暗玉,5,2022-09-25 19:38:36,8,"#55 白夜。埃尔文与阿尔敏的行动轨迹在这一集都是一致的，面对的极端情境也是一致的，都是以己身为诱饵，发动自杀式袭击，为兵长/艾连创造杀敌的机会。都成功了。在选择让谁活下去的时候，选择的是人类将以何种凝视选择胜利的方向。埃尔文的梦想与阿尔敏的梦想，地下室的真相与墙壁外面的大海。戏剧性的是，当兵长把针要注入埃尔文手臂时，埃尔文甩开了，同时这也是一个提问的手势，他回到那个课堂上，向老师发问：老师，你怎么知道，墙壁的外面，不会有人类呢？是这个甩手，还是这个提问，最终让兵长改变了选择。

还是说埃尔文也对墙壁外面的世界，充满了向往。
而这个向往，与阿尔敏是一致的。"
魏知超,5,2021-12-29 15:46:36,3,团长
mamba,5,2019-06-24 17:58:52,7,竞争史上最伟大动漫作品吧！
碧花生,5,2019-10-10 23:20:29,5,「艾伦，你懂的吧，我们不是约好要一起去看海吗，我有对艾伦你撒过谎吗？」
藤椒鸡,5,2019-05-27 22:17:05,6,这季真的吹爆啊！简直是权游前两季的水平！主角说死就死！
铎奇,5,2021-02-14 11:42:10,0,Historia我好🉑️，最后一集的Eren我也🉑️了起来。我靠这个剧太有毒了。
